{
  "$schema": "https://json-schema.org/draft/2020-12/schema",
  "$id": "https://raw.githubusercontent.com/getsentry/MobileBuildMCP/main/schemas/structured-output/mobilebuildmcp.output.session-defaults/2.schema.json",
  "type": "object",
  "additionalProperties": false,
  "allOf": [
    {
      "$ref": "https://raw.githubusercontent.com/getsentry/MobileBuildMCP/main/schemas/structured-output/_defs/common.schema.json#/$defs/errorConsistency"
    }
  ],
  "properties": {
    "schema": {
      "const": "mobilebuildmcp.output.session-defaults"
    },
    "schemaVersion": {
      "const": "2"
    },
    "didError": {
      "type": "boolean"
    },
    "error": {
      "type": [
        "string",
        "null"
      ]
    },
    "data": {
      "type": "object",
      "additionalProperties": false,
      "properties": {
        "currentProfile": {
          "type": "string"
        },
        "profiles": {
          "type": "object",
          "properties": {
            "(default)": {
              "$ref": "https://raw.githubusercontent.com/getsentry/MobileBuildMCP/main/schemas/structured-output/_defs/common.schema.json#/$defs/sessionDefaultsProfile"
            }
          },
          "required": [
            "(default)"
          ],
          "additionalProperties": {
            "$ref": "https://raw.githubusercontent.com/getsentry/MobileBuildMCP/main/schemas/structured-output/_defs/common.schema.json#/$defs/sessionDefaultsProfile"
          }
        },
        "operation": {
          "$ref": "https://raw.githubusercontent.com/getsentry/MobileBuildMCP/main/schemas/structured-output/_defs/common.schema.json#/$defs/sessionDefaultsOperation"
        }
      },
      "required": [
        "currentProfile",
        "profiles"
      ]
    },
    "nextSteps": {
      "$ref": "https://raw.githubusercontent.com/getsentry/MobileBuildMCP/main/schemas/structured-output/_defs/common.schema.json#/$defs/nextSteps"
    }
  },
  "required": [
    "schema",
    "schemaVersion",
    "didError",
    "error",
    "data"
  ]
}
